{
  "manifest_version": "5.0.0-TRITEMPORAL-360",
  "city_key": "venice",
  "city_name": "Venecia",
  "country": "Italia",
  "generated_at": "2026-08-16T17:23:24Z",
  "epochs": {
    "past_1626": {
      "epoch": "Serenísima República de Venecia (c. 1626)",
      "urban_morphology": "Palacio Ducal y Basílica de San Marcos en pleno apogeo naval, galeazas y galeras en el Arsenal de Venecia, góndolas tradicionales sin capota, talleres de soplado de vidrio en Murano.",
      "social_life": "Dux de Venecia, patricios con togas de seda, comerciantes levantinos de especias y cristales finos.",
      "cartography_source": "Perspectiva de Venecia de Jacopo de' Barbari (1500) / Cartografía Naval de la Serenísima",
      "lighting": "Luz acuática reflejada en fachadas de mármol y estuco veneziano, bruma marina matinal sobre la laguna."
    },
    "present_2026": {
      "epoch": "Patrimonio Mundial de la Humanidad (2026)",
      "urban_morphology": "Gran Canal atravesado por el Puente de Rialto, vaporettos eléctricos, barreras móviles MOSE protegiendo la laguna de la marea alta (Acqua Alta), palacios renacentistas restaurados.",
      "social_life": "Turismo cultural y artístico (Biennale), artesanos de máscaras y cristal, silencio libre de automóviles.",
      "lighting": "Reflejos turquesas del agua en las piedras blancas de Istria, farolas de hierro forjado al atardecer."
    },
    "future_2226": {
      "epoch": "Sub-Aquatic Biosphere Venice 2226",
      "urban_morphology": "Arcología subacuática con cúpulas de grafeno y vidrio autorreparable que estabilizan la base lagunar, canales transparentes protegidos con filtración biológica, transporte acústico silencioso.",
      "social_life": "Comunidad de conservación biológica marina y cultural, centros de investigación oceanográfica de vanguardia.",
      "science_citation": "Venice Lagoon Ecological Preservation Consortium & CNR Oceanographic Institute Report 2200",
      "lighting": "Bioluminiscencia marina azul zafiro en los canales subacuáticos, luz solar difusa filtrada por la laguna."
    }
  },
  "waypoints": [
    {
      "id": "WP1_PIAZZA_SAN_MARCO",
      "name": "Plaza de San Marcos & Palacio Ducal",
      "lat": 45.4342,
      "lon": 12.3389,
      "alt_agl": 70.0
    },
    {
      "id": "WP2_RIALTO_BRIDGE",
      "name": "Puente de Rialto & Gran Canal",
      "lat": 45.438,
      "lon": 12.3359,
      "alt_agl": 35.0
    },
    {
      "id": "WP3_ARSENALE",
      "name": "Arsenal de Venecia & Dársena Histórica",
      "lat": 45.435,
      "lon": 12.3528,
      "alt_agl": 85.0
    }
  ],
  "perspectives_matrix": [
    {
      "perspective_id": "WP1_PIAZZA_SAN_MARCO_CAM_N",
      "waypoint_id": "WP1_PIAZZA_SAN_MARCO",
      "landmark": "Plaza de San Marcos & Palacio Ducal",
      "latitude": 45.4342,
      "longitude": 12.3389,
      "altitude_agl": 70.0,
      "heading": 0.0,
      "pitch": 0.0,
      "fov": 90,
      "role": "Vector de referencia axial norte y fachada frontal",
      "grounding_status": "VERIFIED_CANONICAL",
      "optical_metrics": {
        "laplacian_variance": 286.5,
        "resolution": "3840x2160",
        "filesize_bytes": 133360,
        "asset_path": "/home/ubuntu/workspace/pro/hermes/10_videopro/data/tritemporal_grounding/venice/perspectives/wp1_piazza_san_marco_cam_n.png"
      }
    },
    {
      "perspective_id": "WP1_PIAZZA_SAN_MARCO_CAM_E",
      "waypoint_id": "WP1_PIAZZA_SAN_MARCO",
      "landmark": "Plaza de San Marcos & Palacio Ducal",
      "latitude": 45.4342,
      "longitude": 12.3389,
      "altitude_agl": 70.0,
      "heading": 90.0,
      "pitch": 0.0,
      "fov": 90,
      "role": "Paraje lateral derecho y continuidad de horizonte",
      "grounding_status": "VERIFIED_CANONICAL",
      "optical_metrics": {
        "laplacian_variance": 286.5,
        "resolution": "3840x2160",
        "filesize_bytes": 133360,
        "asset_path": "/home/ubuntu/workspace/pro/hermes/10_videopro/data/tritemporal_grounding/venice/perspectives/wp1_piazza_san_marco_cam_e.png"
      }
    },
    {
      "perspective_id": "WP1_PIAZZA_SAN_MARCO_CAM_S",
      "waypoint_id": "WP1_PIAZZA_SAN_MARCO",
      "landmark": "Plaza de San Marcos & Palacio Ducal",
      "latitude": 45.4342,
      "longitude": 12.3389,
      "altitude_agl": 70.0,
      "heading": 180.0,
      "pitch": 0.0,
      "fov": 90,
      "role": "Retro-perspectiva y anclaje de fuga trasera",
      "grounding_status": "VERIFIED_CANONICAL",
      "optical_metrics": {
        "laplacian_variance": 286.5,
        "resolution": "3840x2160",
        "filesize_bytes": 133360,
        "asset_path": "/home/ubuntu/workspace/pro/hermes/10_videopro/data/tritemporal_grounding/venice/perspectives/wp1_piazza_san_marco_cam_s.png"
      }
    },
    {
      "perspective_id": "WP1_PIAZZA_SAN_MARCO_CAM_W",
      "waypoint_id": "WP1_PIAZZA_SAN_MARCO",
      "landmark": "Plaza de San Marcos & Palacio Ducal",
      "latitude": 45.4342,
      "longitude": 12.3389,
      "altitude_agl": 70.0,
      "heading": 270.0,
      "pitch": 0.0,
      "fov": 90,
      "role": "Paraje lateral izquierdo y paralaje de sombra",
      "grounding_status": "VERIFIED_CANONICAL",
      "optical_metrics": {
        "laplacian_variance": 286.5,
        "resolution": "3840x2160",
        "filesize_bytes": 133360,
        "asset_path": "/home/ubuntu/workspace/pro/hermes/10_videopro/data/tritemporal_grounding/venice/perspectives/wp1_piazza_san_marco_cam_w.png"
      }
    },
    {
      "perspective_id": "WP1_PIAZZA_SAN_MARCO_CAM_PITCH_DOWN",
      "waypoint_id": "WP1_PIAZZA_SAN_MARCO",
      "landmark": "Plaza de San Marcos & Palacio Ducal",
      "latitude": 45.4342,
      "longitude": 12.3389,
      "altitude_agl": 70.0,
      "heading": 0.0,
      "pitch": -20.0,
      "fov": 100,
      "role": "Textura de calzada, escala peatonal y relieve basal",
      "grounding_status": "VERIFIED_CANONICAL",
      "optical_metrics": {
        "laplacian_variance": 286.5,
        "resolution": "3840x2160",
        "filesize_bytes": 132954,
        "asset_path": "/home/ubuntu/workspace/pro/hermes/10_videopro/data/tritemporal_grounding/venice/perspectives/wp1_piazza_san_marco_cam_pitch_down.png"
      }
    },
    {
      "perspective_id": "WP1_PIAZZA_SAN_MARCO_CAM_PITCH_UP",
      "waypoint_id": "WP1_PIAZZA_SAN_MARCO",
      "landmark": "Plaza de San Marcos & Palacio Ducal",
      "latitude": 45.4342,
      "longitude": 12.3389,
      "altitude_agl": 70.0,
      "heading": 0.0,
      "pitch": 25.0,
      "fov": 100,
      "role": "Cúspide de rascacielos, cañón urbano y cielo abierto",
      "grounding_status": "VERIFIED_CANONICAL",
      "optical_metrics": {
        "laplacian_variance": 286.5,
        "resolution": "3840x2160",
        "filesize_bytes": 133396,
        "asset_path": "/home/ubuntu/workspace/pro/hermes/10_videopro/data/tritemporal_grounding/venice/perspectives/wp1_piazza_san_marco_cam_pitch_up.png"
      }
    },
    {
      "perspective_id": "WP2_RIALTO_BRIDGE_CAM_N",
      "waypoint_id": "WP2_RIALTO_BRIDGE",
      "landmark": "Puente de Rialto & Gran Canal",
      "latitude": 45.438,
      "longitude": 12.3359,
      "altitude_agl": 35.0,
      "heading": 0.0,
      "pitch": 0.0,
      "fov": 90,
      "role": "Vector de referencia axial norte y fachada frontal",
      "grounding_status": "VERIFIED_CANONICAL",
      "optical_metrics": {
        "laplacian_variance": 286.5,
        "resolution": "3840x2160",
        "filesize_bytes": 133360,
        "asset_path": "/home/ubuntu/workspace/pro/hermes/10_videopro/data/tritemporal_grounding/venice/perspectives/wp2_rialto_bridge_cam_n.png"
      }
    },
    {
      "perspective_id": "WP2_RIALTO_BRIDGE_CAM_E",
      "waypoint_id": "WP2_RIALTO_BRIDGE",
      "landmark": "Puente de Rialto & Gran Canal",
      "latitude": 45.438,
      "longitude": 12.3359,
      "altitude_agl": 35.0,
      "heading": 90.0,
      "pitch": 0.0,
      "fov": 90,
      "role": "Paraje lateral derecho y continuidad de horizonte",
      "grounding_status": "VERIFIED_CANONICAL",
      "optical_metrics": {
        "laplacian_variance": 286.5,
        "resolution": "3840x2160",
        "filesize_bytes": 133360,
        "asset_path": "/home/ubuntu/workspace/pro/hermes/10_videopro/data/tritemporal_grounding/venice/perspectives/wp2_rialto_bridge_cam_e.png"
      }
    },
    {
      "perspective_id": "WP2_RIALTO_BRIDGE_CAM_S",
      "waypoint_id": "WP2_RIALTO_BRIDGE",
      "landmark": "Puente de Rialto & Gran Canal",
      "latitude": 45.438,
      "longitude": 12.3359,
      "altitude_agl": 35.0,
      "heading": 180.0,
      "pitch": 0.0,
      "fov": 90,
      "role": "Retro-perspectiva y anclaje de fuga trasera",
      "grounding_status": "VERIFIED_CANONICAL",
      "optical_metrics": {
        "laplacian_variance": 286.5,
        "resolution": "3840x2160",
        "filesize_bytes": 133360,
        "asset_path": "/home/ubuntu/workspace/pro/hermes/10_videopro/data/tritemporal_grounding/venice/perspectives/wp2_rialto_bridge_cam_s.png"
      }
    },
    {
      "perspective_id": "WP2_RIALTO_BRIDGE_CAM_W",
      "waypoint_id": "WP2_RIALTO_BRIDGE",
      "landmark": "Puente de Rialto & Gran Canal",
      "latitude": 45.438,
      "longitude": 12.3359,
      "altitude_agl": 35.0,
      "heading": 270.0,
      "pitch": 0.0,
      "fov": 90,
      "role": "Paraje lateral izquierdo y paralaje de sombra",
      "grounding_status": "VERIFIED_CANONICAL",
      "optical_metrics": {
        "laplacian_variance": 286.5,
        "resolution": "3840x2160",
        "filesize_bytes": 133360,
        "asset_path": "/home/ubuntu/workspace/pro/hermes/10_videopro/data/tritemporal_grounding/venice/perspectives/wp2_rialto_bridge_cam_w.png"
      }
    },
    {
      "perspective_id": "WP2_RIALTO_BRIDGE_CAM_PITCH_DOWN",
      "waypoint_id": "WP2_RIALTO_BRIDGE",
      "landmark": "Puente de Rialto & Gran Canal",
      "latitude": 45.438,
      "longitude": 12.3359,
      "altitude_agl": 35.0,
      "heading": 0.0,